id,sku,short_description,price,list_price,price_usd,discount,discount_rate,review_count,order_count,inventory_status,is_visible,stock_item_qty,stock_item_max_sale_qty,product_name,brand_id,brand_name
140743889,1588800333600," đã gây ấn tượng với hàng loạt các ưu điểm nổi bật với ngoại hình hiện đại cùng chất lượng tốt. Cùng với đó là với mức giá hợp lý trong phân khúc,  hứa hẹn sẽ đồng hành cùng bạn trong mọi khoảnh khắc ...",4239000,4390000,,151000,3,0,,available,,1000.0,1000.0,Điện thoại Vivo Y21s (4GB/128GB) - Hàng chính hãng,52232,Vivo
191089547,2605364692858,"Thiết kế sang trọng, bền bỉNokia 110 4G sở hữu ngoại hình quen thuộc, khi sử dụng chất liệu nhựa Polycarbonate được tinh chỉnh giúp máy trở nên trẻ trung, năng động và vô cùng bắt mắt.Các cạnh bên ...",809000,850000,,41000,5,0,,available,,1000.0,1000.0,Điện Thoại Nokia 110 4G - Hàng Chính Hãng,19673,Nokia
153581568,9517929258488,"       Masstel trình làng Masstel IZI 55 mẫu điện thoại phổ thông hỗ trợ 4G VoLTE thuộc series IZI, sở hữu thiết kế thân thiện, chip xử lý Unisoc, thời lượng pin ấn tượng và nhiều tính năng tiện í...",649000,649000,,0,0,3,,available,,1000.0,1000.0,Điện thoại Masstel IZI 55 4G - Hàng chính hãng,112638,Masstel
170497385,6551724643612,...,9290000,9990000,,700000,7,0,,available,,1000.0,1000.0,Điện thoại Samsung Galaxy A53 5G (8GB/128GB) - Hàng chính hãng,18802,Samsung
127076431,7302653328347,"Thiết kế mỏng nhẹ, mang đến sự nổi bật cho người dùngĐiện thoại Xiaomi 11 Lite 5G NE (6GB/128GB) được chế tác nguyên khối, sở hữu một thân hình siêu mỏng nhẹ chỉ có trọng lượng 158 g và mỏng 6.8 mm, ...",10490000,10490000,,0,0,42,,available,,1000.0,1000.0,Điện thoại Xiaomi 11 Lite 5G NE (6GB/128GB) - Hàng chính hãng,25422,Xiaomi
142667084,7574621032402,"Thiết kế sang trọng, viền màn hình siêu mỏng cùng màu sắc sang trọngĐiện thoại Vivo Y15a sở hữu một thiết kế không có quá nhiều khác biệt với các sản phẩm smartphone khác đã ra mắt trên thị trường. M...",3220000,3790000,,570000,15,2,,available,,1000.0,1000.0,Điện thoại Vivo Y15A (4GB/64GB) – Hàng Chính Hãng,52232,Vivo
83368040,4445715165755,"Điện Thoại Samsung A52 8GB/128GB - Hàng Chính HãngBộ sản phẩm bao gồm: Thân máy, bộ sạc, dụng cụ lấy sim, sách hướng dẫn.Cuộn Lướt Mượt Mà Trên Màn Hình Tuyệt ĐỉnhMãn nhãn với những hình ảnh chi ti...",7489000,9290000,,1801000,19,10,,available,,1000.0,1000.0,Điện Thoại Samsung Galaxy A52 (8GB/128GB) - Hàng Chính Hãng,18802,Samsung
179159231,9813186492262,"1. HIỆU SUẤT MẠNH MẼ, VẬN HÀNH MƯỢT MÀ1.1 Qualcomm Snapdragon 680Điện Thoại Vivo T1X (4GB/64GB) - Nói Không Với Giật LagCPU 8 nhân , Xung nhịp 2.4GHzSo sánh với Qualcomm Snapdragon 662: Hiệu suất ...",3950000,4490000,,540000,12,0,,available,,1000.0,1000.0,Điện Thoại Vivo T1X (4GB/64GB) - Hàng Chính Hãng,52232,Vivo
160819279,7935804053285,"Điện Thoại Xiaomi Redmi Note 11 4GB/64GB - Hàng Chính HãngBộ sản phẩm bao gồm: Pin, sạc, cáp USB kiểu C, ốp lưng, hướng dẫn, cây tháo sim. Màn hình rộng hiển thị tuyệt vời từ nhiều góc nhìn- Redmi...",3899000,4690000,,791000,17,3,,available,,1000.0,1000.0,Điện Thoại Xiaomi Redmi Note 11 4GB/64GB - Hàng Chính Hãng,25422,Xiaomi
29931445,9153207200108,"Được chứng nhận đạt mức IP68 / IP69K cao nhất, nó có thể xử lý 30 phút ngâm trong 1,5 mét nước hoặc 24 giờ nộp trong 1 mét bê tông. Trong khi đó, nó cũng có thể chịu được những giọt lớn lên tới 1,2 ...",2990000,2990000,,0,0,35,,available,,1000.0,1000.0,"Ulefone Armor X ( chống nước,chống va đập,pin 5.000mAh ) hàng chính hãng",169013,Ulefone
184051220,8177771940060,iPhone 13 mini. Hệ thống camera kép tiên tiến nhất từng có trên iPhone. Chip A15 Bionic thần tốc. Thời lượng pin tăng vọt. Thiết kế bền bỉ. Mạng 5G siêu nhanh.1 Cùng với màn hình Super Retina XDR sáng...,19290000,19290000,,0,0,170,,available,,1000.0,1000.0,Apple iPhone 13 mini,17827,Apple
59519631,8805389674574,"Màn hình giọt nước mang tính thời thượngXiaomi Redmi 9C sở hữu trong mình thiết kế bo tròn mềm mại ở các cạnh mang lại cảm giác thoải mái khi cầm nắm, các nhà sản xuất hoàn thiện rất tỉ mỉ từ đó mang...",2490000,2490000,,0,0,0,,available,,1000.0,1000.0,Điện Thoại Xiaomi Redmi 9C - Hàng Chính Hãng,25422,Xiaomi
67910637,6698038721819,"Thiết kế sang trọng, tinh tếTiếp nối sự thành công của mẫu điện thoại Vsmart Joy 3 thì tới đây, Vsmart tiếp tục chuẩn bị ra mắt sản phẩm điện thoại mới với tên gọi Vsmart Joy 4. Sản phẩm này là bản n...",3190000,3190000,,0,0,0,,available,,1000.0,1000.0,Điện Thoại Vsmart Joy 4 - Hàng Chính Hãng,257333,Vsmart
117720011,7434602943892,HUAWEI MatePad 11*Hình ảnh sản phẩm và nội dung hiển thị trên các trang nêu trên chỉ nhằm mục đích tham khảo. Tính năng và thông số kỹ thuật của sản phẩm thực tế(bao gồm nhưng không g...,11970000,11990000,,20000,0,19,,available,,1000.0,1000.0,Máy Tính Bảng Huawei MatePad 11 | Màn Hình HUAWEI FullView 120 Hz | Kèm Bút cảm ứng Huawei M-Pencil + Bàn phím Smart Magnetic Keyboard,19788,Huawei
159853930,5502663462180,"Điện Thoại Samsung Galaxy S21 FE 5G 8GB/128GB - Hàng Chính HãngBộ sản phẩm gồm: Thân máy, cáp dữ liệu, tài liệu hướng dẫn, dụng cụ lấy sim.Khám phá thế giới qua màn hình 6.4 inch- Galaxy S21 FE 5G ...",12659000,16990000,,4331000,25,1,,available,,1000.0,1000.0,Điện Thoại Samsung Galaxy S21 FE 5G 8GB/128GB - Hàng Chính Hãng,18802,Samsung
17751071,2981234632978,"Thiết kế gọn nhe, tinh tếĐiện Thoại Bavapen B52 với thiết kế gon nhẹ, phần vỏ máy được gia công kỹ lưỡng, cứng cáp tạo sự chắc chắn khi cầm nắm. Đặc biệt, phần mặt lưng và các góc được bo cong mềm mạ...",430000,430000,,0,0,2,,available,,1000.0,1000.0,Điện Thoại Bavapen B52 - Hàng Chính Hãng,25685,Bavapen
153581522,1619656458995, all new Paperwhite 5 (hay all new Paperwhite 11th Gen) là phiên bản thay thế cho chiếc Paperwhite 4 đã ra mắt từ năm 2018. Thường thì sau mỗi 2-3 năm thì nhà sản xuất mới nâng cấp sản phẩm một lần...,7500000,7500000,,0,0,12,,available,,1000.0,1000.0,Máy đọc sách All new Paperwhite Gen 5 (11th) màn hình 6.8 inch có đèn vàng warmlight,111461,OEM
176036536,1477425689717,ĐIỆN THOẠI OPPO RENO7 4G (8GB/128GB) - HÀNG CHÍNH HÃNG.- Bảo hành 12 tháng tại các ttbh OPPO toàn quốc.- 30 NGÀY ĐỔI MỚI 1 - 1 nếu có lỗi từ nhà sản xuất tại các TTBH OPPO Toàn quốc.#OPPOReno ...,8990000,8990000,,0,0,0,,available,,1000.0,1000.0,Điện Thoại OPPO RENO7 4G (8GB/128GB) - Hàng Chính Hãng,25643,OPPO
65492829,9942977542729," bền bỉ hơn, Khéo léo hơn WP5 Pro sử dụng cao su công nghiệp với các yếu tố chống va đập. Bốn góc máy được làm dày dặn độ bền cao cũng như lớp vỏ thép dày và bền cũng như thiết kế ma sát lưng và ph...",4390000,4390000,,0,0,5,,available,,1000.0,1000.0,"Điện thoại Oukitel WP5 Pro (Ram4GB,Rom 64Gb,pin 8.000mAh ,chống va đập,chống nước) - hàng chính hãng",112735,Oukitel
52398564,1072424054029,"Thiết kế không trọng lượngMáy Đọc Sách Kindle Fire HD 10 vỏ ngoài được làm từ nhựa, tạo cảm giác thoải mái khi cầm trên tay, mang đến cho bạn trải nghiệm bất ngờ khi lần đầu tiên cầm máy trên tay khi...",3190000,3190000,,0,0,38,,available,,1000.0,1000.0,Máy tính bảng Kindle Fire HD 10 - Hàng Nhập Khẩu,147856,Kindle
120450615,7632271281594,"Với mức giá tầm trung cùng với cấu hình ổn định, Vivo Y20 2021 mang đến cho người dùng thêm một sự lựa chọn trong tầm giá. Đi kèm với đó là màn hình tràn viền cùng với cụm 3 camera AI ấn tượng chụp ản...",3739000,3990000,,251000,6,4,,available,,1000.0,1000.0,Điện thoại Vivo Y20 2021 (4GB/64GB) - Hàng chính hãng,52232,Vivo
169520871,3991149266871,"Điện Thoại Xiaomi Redmi Note 11 Pro 5G 8GB/128GB - Hàng Chính HãngBộ sản phẩm bao gồm: Bộ sạc, cáp USB Type-C, dụng cụ tháo sim, ốp bảo vệ, hướng dẫn sử dụng nhanh Thiết kế- Màn hình AMOLED 6.67 i...",7859000,8990000,,1131000,13,1,,available,,1000.0,1000.0,Điện Thoại Xiaomi Redmi Note 11 Pro 5G 8GB/128GB - Hàng Chính Hãng,25422,Xiaomi
129167418,7632657640372,"Sở hữu một smartphone có ngoại hình đẹp với cấu hình tốt, giá rẻ không còn là điều không tưởng với Itel L6502, một phiên bản đẹp, giá tốt đến từ Itel đã sẵn sàng cho bạn trải nghiệm.Ngoại hình được c...",2290000,2490000,,200000,8,0,,available,,1000.0,1000.0,"Điện thoại itel Vision1 Pro (L6502) 3GB/32GB , 6.52"" HD+ , Camera kép - Hàng Chính Hãng",111461,OEM
187266104,5693989626441,  ...,4490000,4490000,,0,0,2,,available,,1000.0,1000.0,Điện thoại Gaming Tecno POVA 3 (6GB)/128GB - Helio G88 | 7000 mAh | Sạc nhanh 33W - Hàng Chính Hãng,162007,Tecno
181918564,3063278093997,"đối với điện thoại chống nước,quý khách nên đậy thật kỹ nút sạc,khe sim,tai nghe khi sử dung    Sử dụng pin dung lượng cao 10600mAh, WP16 có thể giúp bạn không phải sạc ...",6990000,6990000,,0,0,0,,available,,1000.0,1000.0,"Điện thoại OUKITEL WP16 (pin 10.600mAh,  Ram 8Gb,Rom 128Gb, màn hình 6,39 in , Android 11, Máy ảnh nhìn ban đêm 20MP, chống nước IP68,chống va đập, hai SIM 4G, NFC..) – hàng chính hãng",112735,Oukitel
74776150,4606254839722,Máy đọc sách Kobo Libra H2O cung cấp dung lượng lưu trữ 8GB. Màn hình có tính năng Comfort Light Pro  phát ra màu sắc tối ưu dựa trên thời gian trong ngày. Pin có thể kéo dài hàng tuần.Máy Kobo Libra...,4250000,4669000,,419000,9,0,,available,,1000.0,1000.0,"Máy đọc sách Kobo Libra H20 8GB Trắng/Đen có đèn nền vàng, chống nước - Hàng nhập khẩu",183625,Kobo
112695200,2555506588385,"Màn hình: TFT LCD, 12.4""Hệ điều hành: Android 11Camera sau: 8MPCamera trước: 5MPChipset: Snapdragon 750GRAM: 4GBBộ nhớ trong: 64GBCổng kết nối/sạc: USB Type-CDung lượng pin: 10.090 mAhBộ sản phẩm gồm:...",9819000,13990000,,4171000,30,5,,available,,1000.0,1000.0,Máy tính bảng Samsung Galaxy Tab S7 FE - Hàng Chính Hãng,18802,Samsung
173557858,1347593486170,"Đánh giá máy tính bảng giá rẻ Amazon Fire HD 8 2020: Đã tốt nay còn tốt hơn!Amazon Fire HD 8 2020 với bộ xử lý nhanh hơn, dung lượng RAM mở rộng cùng cổng sạc USB-C sẽ là chiếc máy tính bảng giá rẻ cự...",1960000,1960000,,0,0,0,,available,,1000.0,1000.0,Máy tính bảng Kindle File HD 8 (10th generation - 2020) Hàng nhập khẩu,147856,Kindle
76798064,4244833932227,"Vì sao lựa chọn Poke3Rất nhiều tính năng để tận hưởng, tốn ít không gian hơn trong một mức giá hợp lí.Màu sắc kết hợp thời trang mớiSự kết hợp thẩm mỹ giữa xanh lục-đen và đen mờ.Khả năng tươ...",4989000,4989000,,0,0,28,,available,,1000.0,1000.0,Máy đọc sách Onyx Boox Poke 3 - Hàng Chính Hãng,183637,Onyx Boox
137572223,6044196956041,"Điện Thoại Oppo A55 4GB/64GB - Hàng Chính HãngBộ sản phẩm bao gồm: Thân máy, bộ sạc, cáp USB, dụng cụ lấy sim, sách hướng dẫn, ốp lưng điện thoại.Màn hình tràn viền, sắc nét- Màn hình trang bị tấm ...",3949000,4990000,,1041000,21,3,,available,,1000.0,1000.0,Điện Thoại Oppo A55 4GB/64GB - Hàng Chính Hãng,25643,OPPO
129868798,3528103970303,"RedMagic 6R: Smartphone chơi game mỏng nhất thế giớiSo với RedMagic 6, Nubia RedMagic 6R là phiên bản giá rẻ hơn. Tuy nhiên, điện thoại vẫn cung cấp khả năng chơi game tuyệt vời nhờ chip xử ...",9490000,15990000,,6500000,41,2,,available,,1000.0,1000.0,"[GAMING PHONE] Điện thoại Redmagic 6R 8/128GB- Hỗ trợ Tiếng Việt | Chơi Game cực đỉnh | Snapdragon 888 5G | Màn hình AMOLED 6.67"" |Pin 4200 mAh | Sạc nhanh 30W - Hàng Chính Hãng",198543,Nubia
127061391,8049838494034,"Màn Hình Đỉnh Cao Cho Chuyển Động Mượt Mà- Mãn nhãn với những hình ảnh chi tiết, rực rỡ trên màn hình Super AMOLED 6.5"" chuẩn FHD+ Super Smooth mang đến trải nghiệm mượt mà tối ưu, bất kể bạn chơi ga...",7949000,10990000,,3041000,28,15,,available,,1000.0,1000.0,Điện Thoại Samsung A52S 5G 8GB/128GB - Hàng Chính Hãng,18802,Samsung
74034401,7811176834350,...,7990000,7990000,,0,0,64,,available,,1000.0,1000.0,Máy Tính Bảng Samsung Galaxy Tab A7 (3GB/64GB) SM-T505 ĐÃ KÍCH HOẠT BẢO HÀNH ĐIỆN TỬ - Hàng Chính Hãng,18802,Samsung
184640901,3657235360008, ...,3790000,3790000,,0,0,1,,available,,1000.0,1000.0,Combo máy đọc sách Kindle paperwhite 5 8GB Black (11th gen) tặng kèm bao da ( Cover ) - Hàng nhập khẩu,147856,Kindle
112821872,7929115365286,"Điện Thoại Xiaomi Redmi 9C 3GB/64GB - Hàng Chính HãngBộ sản phẩm bao gồm: Thân máy, sạc, cáp USB, sách hướng dẫn.Thiết kế trang trọng với màn hình LCD sắc nétRedmi 9C được thiết kế theo phong cách ...",2519000,2990000,,471000,16,26,,available,,1000.0,1000.0,Điện Thoại Xiaomi Redmi 9C 3GB/64GB - Hàng Chính Hãng,25422,Xiaomi
48324874,3962370679163,"Chiếc E-reader mỏng nhất, đẹp nhất và bền nhấtMáy Đọc Sách Kobo Forma mang đến cho bạn trải nghiệm bất ngờ khi lần đầu tiên cầm máy trên tay khi trọng lượng 197g rất nhẹ đôi khi có cảm giác như nó kh...",5990000,6390000,,400000,6,2,,available,,1000.0,1000.0,Máy Đọc Sách Kobo Forma - bản 8GB- Hàng Nhập Khẩu,183625,Kobo
167267098,5158701537317,"Màn hình: Dynamic AMOLED 2X 6.4 "", Full HD +Hệ điều hành: Android 12Camera sau: 12 MP + 12 MP + 8 MPCamera trước: 32 MPChipset: Exynos 2100RAM: 8 GBBộ nhớ trong: 128 GBCổng kết nối/sạc: Type-C...",12659000,16990000,,4331000,25,0,,available,,1000.0,1000.0,Điện thoại Samsung Galaxy S21 FE 5G (8GB/128GB) - Hàng chính hãng,18802,Samsung
179554879,7557332461172,"Màn hình AMOLED 120 Hz.Bộ ba camera 108MP.Sạc nhanh turbo với công suất 67W.MÀN HÌNH MẠNH MẼ KHÔNG ĐƠN THUẦN LÀ NỊNH MẮTMàn hình AMOLED 6,67""Dòng POCO X hiện sử dụng màn hình AMOLED và hỗ trợ DCI-...",6250000,8990000,,2740000,30,1,,available,,1000.0,1000.0,"Điện thoại XIAOMI X4 PRO 5G 6.67""/SNAP695 5G/8G/256G/108+8+2MP/16MP/5000mAh",25422,Xiaomi
169749516,9971766367503,"Màn hình: AMOLED 6.67"", Full HD+Hệ điều hành: Android 11Camera sau: 108 MP + 8 MP + 2 MP + 2 MPCamera trước: 16 MPChipset: MediaTek Helio G96 8 nhânRAM: 8 GBBộ nhớ trong: 128 GBCổng kết nối/sạ...",6499000,7490000,,991000,13,4,,available,,1000.0,1000.0,Điện thoại Xiaomi Redmi Note 11 Pro (8GB/128GB) - Hàng chính hãng,25422,Xiaomi
171110666,4205881589275,"OPPO Reno7 5G- Chuyên gia nhiếp ảnh Chân dungNhìn vào ống kính, cười và tạo dáng – bạn không cần các thiết bị cầu kỳ để chụp được bức chân dung giống như máy ảnh DSLR với hiệu ứng xóa phông tinh tế. ...",12990000,12990000,,0,0,0,,available,,1000.0,1000.0,Điện Thoại OPPO RENO7 5G (8GB/256GB) - Hàng Chính Hãng,25643,OPPO
158959656,9543189302138,"ĐIỆN THOẠI OPPO A55THÔNG SỐ KỸ THUẬT:Màn hình: IPS LCD, 6.51""HD+Hệ điều hành: Android 11Camera sau: Chính 50 MP & Phụ 2 MP, 2 MPCamera trước: 16 MPChip: MediaTek Helio G35RAM: 4 GBBộ nhớ t...",4690000,5739000,,1049000,18,0,,available,,1000.0,1000.0,Điện Thoại Di Động OPPO A55 (4G+64G) - Hàng Chính Hãng,25643,OPPO
160434731,4022909547242,"Máy Tính Bảng Samsung Galaxy Tab A8 4GB/64GB - Hàng Chính HãngBộ sản phẩm bao gồm: Thân máy, sạc, cáp dữ liệu, tài liệu hướng dẫn sử dụng, dụng cụ lấy sim và lấy thẻ nhớ. Màn hình lớn hiển thị nhiề...",6829000,8490000,,1661000,20,2,,available,,1000.0,1000.0,Máy Tính Bảng Samsung Galaxy Tab A8 4GB/64GB - Hàng Chính Hãng,18802,Samsung
175147005,7835702456334,"Màn hình: Super AMOLED 6.4"", Full HD+Hệ điều hành: Android 12Camera sau: 48 MP + 8 MP + 5 MP + 2 MPCamera trước: 13 MPChipset: Exynos 1280RAM: 6 GBBộ nhớ trong: 128 GBCổng kết nối/sạc: Type...",6549000,8490000,,1941000,23,0,,available,,1000.0,1000.0,Điện thoại Samsung Galaxy A33 5G (6GB/128GB) - Hàng chính hãng,18802,Samsung
137582801,9355040997148,"Điện Thoại Realme C21Y 3GB/32GB - Hàng Chính HãngBộ sản phẩm bao gồm: Thân máy, sạc USB, dụng cụ lấy sim, sách hướng dẫn sử dụng. Đột phá với ngoại hình thời thượng- Sở hữu màn hình giọt nước thời...",2579000,3690000,,1111000,30,0,,available,,1000.0,1000.0,Điện Thoại Realme C21Y 3GB/32GB - Hàng Chính Hãng,247549,Realme
162866839,7970341900608,"VNT Tab8 là thiết bị máy tính bảng của VNPT TechnologySản phẩm được cung cấp dành cho chương trình “Sóng và máy tính cho em” được xây dựng và triển khai với mục đích hỗ trợ các em học sinh,đặc biệt l...",2600000,3146000,,546000,17,0,,available,,1000.0,1000.0,Máy tính bảng VNPT Technology VNT Tab8 8 Inch Android 11 RAM 3GB - Hàng chính hãng,171169,VNPT Technology
186591556,8417515698094,"Cấu hình Xiaomi Black Shark 5 cực khủngBlack Shark 5 màu được trang bị chipset Snapdragon 870, kết hợp với hai khoang hơi để làm mát. Ở đây không có SSD, chỉ có RAM LPDDR5 (8/12 GB) và bộ nhớ UFS 3.1...",12000000,14500000,,2500000,17,0,,available,,1000.0,1000.0,[Hàng Chính Hãng Quốc tế] Điện Thoại Xiaomi Black Shark 5 (8GB/128GB),233903,Black Shark
172313857,7154751600416,"Cấu hình Điện thoại Realme C11 (2021) Màn hình: IPS LCD6.5""HD+Hệ điều hành: Android 11 (Go Edition)Camera sau: 8 MPCamera trước: 5 MPChip: Spreadtrum SC9863ARAM: 2 GBBộ nhớ trong: 32 GBSIM: 2...",2242500,2990000,,747500,25,0,,available,,1000.0,1000.0, Điện Thoại Realme C11 2021 (2GB/32GB) - Hàng Chính Hãng,247549,Realme
160556149,8776248083494,"Màn hình: TFT 10.5"", Full HD+Hệ điều hành: Android 11Camrea sau: 8 MPCamera trước: 5MPChipset: Unisoc Tiger T618RAM: 4GBBộ nhớ trong: 64GBCổng kết nối/sạc: USB Type-CDung lượng pin: 7.040 mAh...",6839000,8490000,,1651000,19,3,,available,,1000.0,1000.0,Máy tính bảng Samsung Galaxy Tab A8 - Hàng chính hãng,18802,Samsung
178575037,7388798756313,"Điện Thoại Nokia C21 Plus 2GB/32GB - Hàng Chính HãngBộ sản phẩm gồm: Thân máy, cáp Micro USB, sạc, tai nghe, ốp lưng, sách hướng dẫn.Giải Trí Bất Tận Trên Màn Hình Lớn- Màn hình 6,5 inch rực rỡ hoà...",2169000,2690000,,521000,19,0,,available,,1000.0,1000.0,Điện Thoại Nokia C21 Plus 2GB/32GB - Hàng Chính Hãng,19673,Nokia
160203316,9337385208527,"Cấu hình Điện thoại Samsung Galaxy M12 Màn hình: 6.5""HD+Hệ điều hành: Android 11Camera sau: Chính 48 MP & Phụ 5 MP, 2 MP, 2 MPCamera trước: 8 MPChip: Exynos 850RAM: 4 GBBộ nhớ trong: 64 GB...",3469000,3699000,,230000,6,4,,available,,1000.0,1000.0,Điện Thoại Samsung Galaxy M12 (4GB/64GB) - ĐÃ KÍCH HOẠT ĐIỆN TỬ - Hàng Chính Hãng,18802,Samsung
190542002,2802859984329,"Tháng 06/2022 điện thoại POCO C40 đã chính thức được cho ra mắt tại thị trường Việt Nam, sở hữu cho một mình màn hình kích thước lớn, viên pin dung lượng khủng và một con chip JR510 mới lạ trên thị tr...",3190000,3490000,,300000,9,0,,available,,1000.0,1000.0,Điện thoại Xiaomi POCO C40 (4 GB/64 GB) - Hàng chính hãng,25422,Xiaomi
185887807,5467649144281,            ...,17990000,18990000,,1000000,5,0,,available,,1000.0,1000.0,"Điện thoại Gaming Redmagic 7 - MH AMOLED 6.8"" Full HD+ 165Hz - Qualcomm Snapdragon 8 Gen 1 8 nhân - HT làm mát 8.0 - Hàng chính hãng",7355445,Redmagic
124877310,2049961119693,"Thiết kê trẻ trung, cứng cápKhông màu mè, không phức tạp,  được thiết kế theo phong cách tối giản nhưng vẫn rất bắt mắt và đem đến sự thoải mái cho người dùng khi cầm trên tay. Các góc cạnh được bo ...",4690000,5490000,,800000,15,0,,available,,1000.0,1000.0,Điện thoại Samsung Galaxy A22 (6GB/128GB) - Hàng chính hãng- Đã kích hoạt bảo hành điện tử,18802,Samsung
120135792,2234145268952,"Thiết kế mới lạ, sang trọng nhưng không kém phần hấp dẫnSamsung Galaxy A32 có ngôn ngữ thiết kế cao cấp, sang trọng mặt lưng nổi bật cụm 4 camera cực chất không quá hào nhoáng nhưng vẫn đủ để giúp ng...",6490000,6490000,,0,0,21,,available,,1000.0,1000.0,Điện thoại Samsung Galaxy A32 (6GB/128GB) - Hàng Chính Hãng,18802,Samsung
91281318,1417706155548,   ...,9090000,9090000,,0,0,2,,available,,1000.0,1000.0,Máy Đọc Sách Likebook P10 - Hàng chính hãng,419263,Likebook
125753416,4726658154314,"Thiết kế sang trọng, bền bỉNokia 110 4G sở hữu ngoại hình quen thuộc, khi sử dụng chất liệu nhựa Polycarbonate được tinh chỉnh giúp máy trở nên trẻ trung, năng động và vô cùng bắt mắt.Các cạnh bên ...",789000,850000,,61000,7,2,,available,,1000.0,1000.0,Điện thoại Nokia 110 4G - Hàng chính hãng,19673,Nokia
173164387,1871264608187,     Thông số kỹ thuậtCông nghệ Memory Fusion (Bộ Nhớ Hợp Nhất) được thiết kế để tận dụng bộ nhớ chỉ đọc (ROM) không được sử dụng và chuyển chúng cho các hoạt độn...,2990000,3990000,,1000000,25,0,,available,,1000.0,1000.0,"Điện thoại TECNO Spark 8C (4GB/128GB) - RAM tùy biến mở rộng tới 7GB |Pin 5000 mAh| 6.6"" HD+ 90Hz (KG5k) - Hàng chính hãng",162007,Tecno
140146799,1693574689497," được xem là phiên bản nâng cấp của  ra mắt trước đó, được thừa hưởng thiết kế đẹp mắt và nâng cấp về hiệu năng mạnh mẽ hơn.Thiết kế tinh xảo, bắt mắtNgoại hình  được kế nhiệm từ phiên bản đi trước ...",7949000,10990000,,3041000,28,0,,available,,1000.0,1000.0,Điện thoại Samsung Galaxy A52s 5G (8GB/128GB) - Hàng chính hãng,18802,Samsung
172670979,7211263254462,"Điện Thoại Samsung Galaxy S21 FE 5G 8GB/256GB - Hàng Chính HãngBộ sản phẩm gồm: Thân máy, cáp dữ liệu, tài liệu hướng dẫn, dụng cụ lấy sim. Khám phá thế giới qua màn hình 6.4 inch- Galaxy S21 FE 5...",14539000,18990000,,4451000,23,0,,available,,1000.0,1000.0,Điện Thoại Samsung Galaxy S21 FE 5G 8GB/256GB - Hàng Chính Hãng,18802,Samsung
145867932,1653496033184,Điện Thoại Vivo Y15S RAM 3GB + 32 GB - Bảo Hành Chính Hãng THÔNG SỐ KỸ THUẬT:- RAM: 3GB- Dung lượng lưu trữ: 32GB- Dung lượng pin: 5000mAh- Số khe SIM: Hai SIM hai sóng (DSDS)- Tiện ích bảo mật...,3400000,3400000,,0,0,0,,available,,1000.0,1000.0,Điện thoại Vivo Y15s (3+32GB) trắng xanh - Hàng Chính Hãng,52232,Vivo
167952107,4950487260595,Samsung S22 là một trong những cái tên đáng được mong chờ nhất trong thời điểm hiện tại dự kiến sẽ trình làng trong thời gian sắp tới. Sở hữu thiết kế mỏng cùng hiệu năng mạn...,21990000,21990000,,0,0,0,,out_of_stock,,,,Điện thoại Samsung Galaxy S22 5G (8GB/128GB ) - Hàng chính hãng - ĐÃ KÍCH HOẠT BẢO HÀNH ĐIỆN TỬ,18802,Samsung
141133864,4219692376028,"Điện Thoại Oppo A15s 4GB/64GB - Hàng Chính HãngBộ sản phẩm bao gồm: Thân máy, sạc, cáp USB, dụng cụ lấy sim, sách hướng dẫn, ốp lưng điện thoại.Màn hình tràn viền, sắc nét- Oppo A15s được trang bi...",3889000,4290000,,401000,9,1,,available,,1000.0,1000.0,Điện Thoại Oppo A15s 4GB/64GB - Hàng Chính Hãng,25643,OPPO
5868813,5499695984248,"Thiết kế đỉnh caoĐiện Thoại Bphone 3 - Hàng Chính Hãng là smartphone android đầu tiên có thiết kế Tràn đáy với viền đều hai bên và đáy rất mỏng, chỉ 2.25mm, mỏng nhất hiện nay. Bphone 3 cho cảm giác ...",6990000,6990000,,0,0,0,,available,,1000.0,1000.0,Điện Thoại Bphone 3 - Hàng Chính Hãng,229213,Bphone
172175893,3074207398934,"Xiaomi Redmi Note 11 Pro nằm trong phân khúc tầm trung nhưng sở hữu những tính năng rất đắt giá như: Màn hình đục lỗ cực lớn tần số quét 120Hz, pin trâu 5.000 mAh hỗ trợ sạc nhanh 67W, camera khủng 10...",7849000,8990000,,1141000,13,0,,available,,1000.0,1000.0,Điện thoại Xiaomi Redmi Note 11 Pro 5G  (8GB/128GB) - Hàng chính hãng,25422,Xiaomi
